{
  "schema": "uniform.quitting-game/v1",
  "players": 4,
  "continuation": [0, 0, 0, 0],
  "payoffs": {
    "1": [4, 2, 3, -2],
    "2": [-3, -4, 3, 1],
    "3": [2, 4, 0, -2],
    "4": [2, 1, -4, 4],
    "5": [-3, 1, 0, 4],
    "6": [-3, -2, -3, 1],
    "7": [0, 1, -4, 4],
    "8": [2, -2, 0, 1],
    "9": [-4, -1, -4, 3],
    "10": [2, 2, -4, 2],
    "11": [-2, 2, -3, 2],
    "12": [3, 2, 0, -2],
    "13": [-2, -1, -4, 2],
    "14": [-3, -4, 4, 2],
    "15": [2, 1, -4, -2]
  }
}
