{
  "schema": "uniform.quitting-game/v1",
  "title": "Adversarial 4-Player Candidate 46876 (Discovered via Mixed Grid Scan)",
  "players": 4,
  "continuation": [0, 0, 0, 0],
  "payoffs": {
    "1": [0, 4, -4, -4],
    "2": [3, 3, 2, -4],
    "3": [0, -1, 2, 4],
    "4": [1, 4, -3, 2],
    "5": [-2, -3, -3, 0],
    "6": [4, -1, -4, 4],
    "7": [4, -2, 1, -3],
    "8": [3, 3, -3, -3],
    "9": [-3, -3, -2, 4],
    "10": [0, -1, 4, 3],
    "11": [-2, 2, 4, 4],
    "12": [0, -2, -3, -2],
    "13": [-2, 2, -1, 0],
    "14": [1, -4, -1, 1],
    "15": [3, -1, -3, 1]
  },
  "provenance": {
    "kind": "adversarial-mixed-grid-screen",
    "seed": 42,
    "sample_id": 46876,
    "min_mixed_regret_grid3": "8/9"
  }
}
